{"execution_role":"inference","input":{"numeric":"wrap32","shape":[2,3]},"input_representation":"masked_ring","logical_plan_digest":"ccb6dc4466602d04fd5097f4b0a49aa555de876e4e99427eed7816a67b2a6df1","output":{"numeric":"wrap32","shape":[2,2]},"output_representation":"masked_ring","schema_version":"pllm.region_program.v1","steps":[{"input":{"numeric":"wrap32","shape":[2,3]},"input_representation":"masked_ring","kernel":{"artifact_digest":"cccccccccccccccccccccccccccccccccccccccccccccccccccccccccccccccc","id":"core-wrap32","implementation":"pllm_core_matrix_wrap32","input_numeric":"wrap32","method_id":"masked-linear","method_version":"1","output_numeric":"wrap32","version":"1"},"method":{"artifact_digest":"bbbbbbbbbbbbbbbbbbbbbbbbbbbbbbbbbbbbbbbbbbbbbbbbbbbbbbbbbbbbbbbb","id":"masked-linear","input_representation":"masked_ring","operator":"linear","output_representation":"masked_ring","properties":{"experimental":false,"needs_client_weights":false,"needs_online_preparation":false,"online_parties":1,"uses_he":false},"version":"1"},"operation_id":"linear-0","operator":"linear","output":{"numeric":"wrap32","shape":[2,2]},"output_representation":"masked_ring"}]}
